"524","三民國小附設幼兒園-天鵝班","民權東路5段1號","莊敬里16~28","莊敬里全里","27646080轉231",
"525","基督教新生教團台北民生教會","新中街10巷2號","東榮里1~6","東榮里全里","27682905",
"526","民權國小多元學習教室(1)118","民權東路4段200號","東榮里7~13","27652327轉33",
"527","民權國小多元學習教室(3)120","民權東路4段200號","東榮里14~19","27652327轉33",
"528","二村基石中心","民生東路5段69巷2弄10號","東榮里20~25",""276383040912578940"",
"529","聯合二村教會","民生東路5段69巷2弄12號","東榮里26~33",""276383040912578940"",
"530","健康國小終身學習中心","延壽街168號","三民里1~10","25282814轉136",
"531","臺北市立圖書館三民分館視廳室","民生東路5段163之1號6樓","三民里11~17","三民里全里","27600408轉16",
"532","民權國小辦公室(112)","民權東路4段200號","三民里18~25","27652327轉33",
"533","民權國小多元學習中心(117)","民權東路4段200號","三民里26~32","27652327轉33",
"534","民權區民活動中心禮堂南側","民權東路5段臨43號(民權大橋下)","新益里1~7","87878787轉829",
"535","民生國中活動中心西側","新東街30巷1號","新益里8~12","27653433轉300",
"536","民生國中活動中心東側","新東街30巷1號","新益里13~18","新益里全里","27653433轉300",
"537","海華大廈休閒中心","民生東路5段171號地下1樓","富錦里1~3、5~8","27661804",
"538","民權國小多元教室(111)","民權東路4段200號","富錦里4、15、18~23","富錦里全里","27652327轉33",
"539","民權國小潛能開發班(1)","民權東路4段200號","富錦里9~14、16~17","27652327轉33",
"540","民生國中會議室2","新東街30巷1號","新東里13~19",""092204293827653433轉303"",
"541","民生國中童軍教室","新東街30巷1號","新東里2~7",""092204293827653433轉303"",
"542","民生國中教師會教室","新東街30巷1號","新東里1,8~12","新東里全里",""092204293827653433轉303"",
"543","健康國小終身學習中心前川堂1","延壽街168號","富泰里1~5、9","25282814轉136",
"544","民生社區中心8樓三民區民活動中心","民生東路5段163之1號8樓","富泰里6~8、16~20","富泰里全里","87878787轉829",
"545","民生社區中心4樓集會堂川堂","民生東路5段163之1號4樓","富泰里10~15","27666959",
"546","介壽國中711教室","延壽街401號","介壽里1~8","27674496轉510",
"547","介壽國中713教室","延壽街401號","介壽里9~15","27674496轉510",
"548","介壽國中715教室","延壽街401號","介壽里16~21","介壽里全里","27674496轉510",
"549","民族國小輔導室","民生東路4段97巷7號","精忠里1~5","精忠里全里","27124872",
"550","民族國小資源1教室","民生東路4段97巷7號","精忠里6~10","27124872",
"551","民族國小資源2教室","民生東路4段97巷7號","精忠里11~16","27124872",
"552","西松國小鄉土教室(補校朷一甲)","三民路5號(由南京東路5段147巷側門進入)","東光里1~8","27609221",
"553","西松國小社會教室2(補校朷一乙)","三民路5號(由南京東路5段147巷側門進入)","東光里9~17","27609221",
"554","西松國小社會教室1(補校高一乙)","三民路5號(由南京東路5段147巷側門進入)","東光里18~25","東光里全里","27609221",
"555","西松國小社會教室(補校高二甲)","三民路5號(由南京東路5段147巷側門進入)","東光里26~33","27609221",
"556","平安新村甲區管理委員會","延壽街348號1樓","龍田里1~4、37~39","27655730",
"557","介壽國中702教室","延壽街401號1樓","龍田里5~11","27674496轉500",
"558","介壽國中704教室","延壽街401號1樓","龍田里12~14、32~35","27674496轉500",
"559","民生國小1年1班教室","敦化北路199巷18號1樓","龍田里15~19","27122452轉830",
"560","民生國小1年2班教室","敦化北路199巷18號1樓","龍田里20~26","龍田里全里","27122452轉830",
"561","民生國小1年3班教室","敦化北路199巷18號1樓","龍田里27~31、36","27122452轉830",
"562","東昌里民活動場所","民生東路4段112巷7弄24號","東昌里7~12","東昌里全里","0919395565",
"563","車庫","民生東路4段112巷3弄3號","東昌里1~6","0919395565",
"564","漢家幼兒園","南京東路4段133巷6弄2號1樓","東勢里1~6","27131091",
"565","歐先生宅","南京東路4段133巷7弄11號1樓","東勢里7~13","東勢里全里","27172185",
"566","金陵教會","南京東路4段133巷6弄20號1樓","東勢里14~18","0926068727",
"567","臺北浸信會頌恩堂","敦化北路145巷30號1樓","中華里8~10、20、25","87122215",
"568","賀瑞幼兒園","南京東路4段53巷11弄1號","中華里11~16","中華里全里","27127575",
"569","臺北市立圖書館啟明分館1樓","敦化北路155巷76號1樓","中華里5~7、17~19、24","2514-8443",
"570","民生國小1年4班教室","敦化北路199巷18號1樓","中華里1~4、21~23","27122452轉831",
"571","思高幼兒園思高中心","民生東路3段125號","民有里1~4、12","27133897",
"572","中山國中哺(集)乳室","復興北路361巷7號","民有里5~10","27126701轉501",
"573","中山國中健康與體育領域教室","復興北路361巷7號","民有里11、13~17","27126701轉501",
"574","中山國中補校辦公室","復興北路361巷7號","民有里18~25","27126701轉501",
"575","中山國中第1教室","復興北路361巷7號","民有里26~32","民有里全里","27126701轉501",
"576","民福里民活動場所","民權東路3段103巷5弄5號1樓","民福里4~5、8、10、11~13","民福里全里","0934332936",
"577","民福社區服務中心","民權東路3段191巷34之1號1樓","民福里3、6、7、9、14、18、20、26","0934332936",
"578","上達汽車有限公司","民族東路687號1樓","民福里21~25、27","87123456",
"579","恩光教會","民權東路3段191巷74號1樓","民福里1~2、15~17、19","0963266909",
"580","松基區民活動中心禮堂","長春路339巷2號地下1樓","松基里1~9","87878787轉854",
"581","松基區民活動中心第3教室","長春路339巷2號地下1樓","松基里10~16","松基里全里","87878787轉854",
"582","松山國小游泳池入口","八德路4段746號","慈祐里1~5、19~21","27672907轉601",
"583","更新大樓中庭","八德路4段606號","慈祐里12~16、22","0928283701",
"584","松山長老教會1樓","饒河街105號","慈祐里6~11、17、18","慈祐里全里","27684081",
"585","西松國小6年1班","三民路5號","安平里3~7、11、33","27609221",
"586","沐恩堂","南京東路5段251巷45號","安平里1~2、9~10、12~13","27686926",
"587","安平區民活動中心2樓","南京東路5段291巷44弄23之1號2樓","安平里16~21","0935865368",
"588","恩友堂第1交誼廳","寶清街123號","安平里14~15、22~27","27670760",
"589","恩友堂第2交誼廳","寶清街123號","安平里8、28~32","安平里全里","27670760",
"590","西松高中(多功能教室1)","健康路325巷7號","鵬程里1、14~18","25282295",
"591","鵬程區民活動中心","健康路399號3樓","鵬程里2~7、9","87878787轉829",
"592","西松高中(多功能教室2)","健康路325巷7號","鵬程里8、10~13","鵬程里全里","25282295",
"593","西松高中702教室","健康路325巷7號","自強里4~6、10","25282295",
"594","健康國小終身學習中心前川堂2","延壽街168號","自強里13~15、24~25","25282814轉136",
"595","健康國小103教室前川堂","延壽街168號","自強里1~3、20~21","自強里全里","25282814轉136",
"596","自強區民活動中心","三民路35巷9號","自強里7、16~19、23","87878787轉829",
"597","健安新城G區管委會辦公室","三民路80巷1號","自強里8~9、11~12、22、26","25287735",
"598","中崙高中2樓7年8班教室","八德路4段101號2樓","吉祥里1~5","27535316轉400",
"599","中崙高中2樓8年5班教室","八德路4段101號2樓","吉祥里6~10、12","27535316轉400",
"600","中崙高中2樓8年2班教室","八德路4段101號2樓","吉祥里11、13~16","27535316轉400",
"601","中崙高中2樓7年5班教室","八德路4段101號2樓","吉祥里17~20、24","吉祥里全里","27535316轉400",
"602","中崙高中2樓7年2班教室","八德路4段101號2樓","吉祥里21~23、25~27","27535316轉400",
"603","新聚區民活動中心(1)","南京東路5段374號1樓","新聚里3~8、10、12","新聚里全里","87878787轉829",
"604","新聚區民活動中心(2)","南京東路5段374號1樓","新聚里9、18、20、24、25、29~30","87878787轉829",
"605","9號車庫","南京東路5段250巷9之3號(揚登牙醫)旁停車場","新聚里11、17、19、21~22、26~28","0910273876",
"606","財團法人萬國道德總會(立德長青活動中心)","南京東路5段250巷18弄46號1樓","新聚里1~2、13~16、23","0970126384",
"607","復盛區民活動中心第1教室","市民大道5段99之1號(八德路4段106巷內)","復盛里15~21","87878787轉829",
"608","復盛區民活動中心第2教室","市民大道5段99之1號(八德路4段106巷內)","復盛里7~14","復盛里全里","87878787轉829",
"609","復盛區民活動中心第3教室","市民大道5段99之1號(八德路4段106巷內)","復盛里1~6","87878787轉829",
"610","張先生宅","臺北市松山區八德路4段182號","復盛里22~26","87878787轉846",
"611","敦化國中701教室","南京東路3段300號1樓","中正里1~5","87717890轉51",
"612","敦化國中702教室","南京東路3段300號1樓","中正里6~13","87717890轉51",
"613","敦化國中703教室","南京東路3段300號1樓","中正里14~21","87717890轉51",
"614","敦化國中704教室","南京東路3段300號1樓","中正里22~28","87717890轉51",
"615","敦化國中705教室","南京東路3段300號1樓","中正里29~34","中正里全里","87717890轉51",
"616","張先生宅","八德路2段366巷17號","中崙里1~9","中崙里全里","27719791",
"617","周先生宅","八德路2段366巷22號","中崙里10~18","0933092641",
"618","育達商職105教室","寧安街12號","美仁里1~6","美仁里全里","25706767轉402",
"619","育達商職106教室","寧安街12號","美仁里7~11","25706767轉402",
"620","華南社區中庭(1)","延吉街46巷8號旁","吉仁里1~7",""25787714.25792333"",
"621","華南社區中庭(2)","延吉街46巷3號旁","吉仁里8~16","吉仁里全里",""25787714.25792333"",
"622","陳先生車庫","市民大道4段臨119號(八德路3段8巷底)","敦化里1~7、12~13","25778430",
"623","馨兒園幼兒園","八德路3段12巷60號","敦化里8~11、20~24","敦化里全里","25775928",
"624","卡兒堡幼兒園","八德路12巷57弄39號","敦化里16、25~28、30","25784555",
"625","慈賢宮","八德路3段74巷14弄18號","敦化里14~15、17~19、29",""25784076 0910215841"",
"626","聖若瑟天主堂","八德路3段158巷22號1樓","復源里1~2、5、11~14","復源里全里","25775286.","0932318680",
"627","美仁浸信會","八德路3段106巷106號1樓","復源里3~4、6~10","25792065",
"628","門諾會光復教會","光復南路46巷1之2號","復建里1~2、5、7、9",""25782238"",
"629","復建區民活動中心","八德路3段158巷7弄20號","復建里6、11、12、14","復建里全里","25779061",
"630","台北蒙恩堂","光復南路32巷3號","復建里3、4、8、10、13","25700564",
"631","育達商職107教室","寧安街12號","復勢里1~6","25706767轉402",
"632","育達大學臺北推廣教育中心H112多功能會議中心","南京東路4段120巷27號","復勢里7~11","25706949轉1121",
"633","法光寺","光復北路60巷20號","復勢里12~15","復勢里全里","25791940",
"634","博仁社區健康中心","光復北路82號","復勢里16~21","25786677轉2229",
"635","中崙教會教育館","敦化南路1段80巷36號","福成里1~5","福成里全里","27216181",
"636","財團法人臺北市中崙福成宮","市民大道4段71號","福成里6~10","27516796",
"637","忠駝國宅乙區管理委員會","基隆路1段364巷10號1樓","西村里1-8","27223249",
"638","西村區民活動中心","基隆路1段364巷22號1樓","西村里9-18","西村里全里","27586396",
"639","忠駝國宅丙區管理委員會","基隆路1段364巷26號1樓","西村19-28","27237030",
"640","正和區民活動中心〈左邊〉","仁愛路4段452巷3號","正和里1-7,10-12","正和里全里","27239777-812",
"641","正和區民活動中心〈右邊〉","仁愛路4段452巷3號","正和里8,13-14,16-17,19-20,25","27239777-812",
"642","基督教信義堂","光復南路443巷9號","正和里9,15,18,21-24","27299580",
"643","興隆整宅管委會","興隆里基隆路1段350-48號","興隆里1-7","27206149",
"644","臺北市議會後門","興隆里仁愛路4段507號(松高路門口)","興隆里8-15","興隆里全里","27297708",
"645","三興國小資源教室〈一〉","基隆路2段99號","中興里1-7","27364687",
"646","三興國小資源教室〈二〉","基隆路2段99號","中興里8-14","中興里全里","27364687",
"647","松山高中1年15班教室","基隆路1段156號","新仁里1-9","27535968",
"648","松山高中1年16班教室","基隆路1段156號","新仁里10-21","新仁里全里","27535968",
"649","市府捷運大廈前空地","忠孝東路5段45號1樓","興雅里1-8","興雅里全里","27665664",
"650","興雅區民活動中心〈左側〉","松隆路36號3樓","興雅里9-14","27239777-812",
"651","興雅區民活動中心〈右側〉","松隆路36號3樓","興雅里15-21","2723977-812",
"652","興雅區民活動中心閱覽室","松隆路36號3樓","興雅里22-28","27239777-812",
"653","松山高中1年12班教室","基隆路1段156號","敦厚里1-6","27686822",
"654","松山高中1年13班教室","基隆路1段156號","敦厚里7-14","27686822",
"655","松山高中1年14班教室","基隆路1段156號","敦厚里15-22","敦厚里全里","27686822",
"656","松山工農勤業樓2樓201教室","忠孝東路5段236巷15號","廣居里1-5","27226616-612",
"657","松山工農勤業樓2樓202教室","忠孝東路5段236巷15號","廣居里6-12","廣居里全里","27226616-612",
"658","松山工農勤業樓2樓204教室","忠孝東路5段236巷15號","廣居里13-18","27226616-612",
"659","松山工農勤業樓2樓205教室","忠孝東路5段236巷15號","廣居里19-23","27226616-612",
"660","松山工農勤業樓2樓207教室","忠孝東路5段236巷15號","廣居里24-29","27226616-612",
"661","興雅國中7年2班教室","松德路168巷15號","安康里1-5","安康里全里","27232771-50",
"662","興雅國中7年3班教室","松德路168巷15號","安康里6-10","27232771-50",
"663","興雅國中7年4班教室","松德路168巷15號","安康里11-15","27232771-50",
"664","興雅國中數學教室","松德路168巷15號","安康里16-20","27232771-50",
"665","興雅國中8年4班教室","松德路168巷15號","安康里21-26","27232771-50",
"666","興雅國中8年3班教室","松德路168巷15號","安康里27-28","27232771-50",
"667","興雅國中8年2班教室","松德路168巷15號","安康里29-33","27232771-50",
"668","境靈廟對面空地","永吉路180巷30弄1號","六藝里1-8","六藝里全里","0911992333",
"669","里民活動場所","永吉路180巷30號","六藝里9-14","27614726",
"670","興雅國小103教室","基隆路1段83巷9號","雅祥里1-6","雅祥里全里","27616071",
"671","興雅國小104教室","基隆路1段83巷9號","雅祥里7-12","27616071",
"672","興雅國小生活教室1","基隆路1段83巷9號","雅祥里13-20","27616071",
"673","永吉國中8年12班教室","松隆路161號","五常里1-8","五常里全里","27649066-125",
"674","永吉國中多功能教室","松隆路161號","五常里9-15","27649066-125",
"675","璞真建設股份有限公司〈空屋〉","永吉路200巷11弄9號","五全里1-7","五全里全里","0963352539",
"676","五全里里民活動場所","永吉路278巷1弄13號","五全里8-14","27620007",
"677","基督教宣道會松山堂福群幼稚園","永吉路278巷37弄18號","五全里15-22","27652064-10",
"678","松山進安宮活動中心","永吉路517巷8弄12-1號","永吉里1-4","永吉里全里","27614286",
"679","松山進安宮圖書室","永吉路517巷8弄12-2號","永吉里5-10","27614286",
"680","松山進安宮會議室","永吉路517巷8弄12-3號","永吉里11-17","27614286",
"681","永春區民活動中心","松山路294號4樓","長春里1-5,10","長春里全里","0963352553",
"682","松山福音堂","虎林街108巷42號","長春里7,11~15,18~19","27676469",
"683","里民活動場所","虎林街88巷64號","長春里6,8~9,16~17,20~21","27609087",
"684","永吉國中8年1班教室","松隆路161號","四育里1-5","27649066",
"685","永吉國中8年2班教室","松隆路161號","四育里6-10,18","四育里全里","27649066",
"686","永吉國中8年3班教室","松隆路161號","四育里11-14","27649066",
"687","永吉國中教師會","松隆路161號","四育里15-17,19-20","27649066",
"688","永春國小109教室","松山路225巷48號","四維里1,16-20","四維里全里","27641314",
"689","永春國小110教室","松山路225巷48號","四維里2-4,11","27641314",
"690","永春國小111教室","松山路225巷48號","四維里5-10","27641314",
"691","永春國小112教室","松山路225巷48號","四維里12-15","27641314",
"692","永吉國小115教室","松山路287巷5號","永春里1-5","永春里全里","87858111",
"693","永吉國小116教室","松山路287巷5號","永春里6-10","87858111",
"694","永吉國小117教室","松山路287巷5號","永春里11-16","87858111",
"695","永吉國小118教室","松山路287巷5號","永春里17-22","87858111",
"696","聯勤富台新城自治會","忠孝東路5段295巷3號","富台里2,4-5,7,13","27603843",
"697","救總台北兒童福利中心A棟穿堂","虎林街120巷270號","富台里6,8,14-16","富台里全里","27679264",
"698","救總台北兒童福利中心B棟101教室前空地","虎林街120巷270號","富台里1,3,9-12,17","27679264",
"699","興雅國中9年4班教室","松德路168巷15號","國業里2-5","27232771",
"700","興雅國中9年3班教室","松德路168巷15號","國業里7-12","27232771",
"701","興雅國中9年2班教室","松德路168巷15號","國業里13-18","27232771",
"702","興雅國中3101健體教室","松德路168巷15號","國業里19-24","27232771",
"703","興雅國中縫紉教室","松德路168巷15號","國業里1,6,25-28","國業里全里","27232771",
"704","松山家商視聽教室","松山路655號","松隆里2-7","27261118",
"705","松山家商交通隊器材室","松山路655號","松隆里1,8-12","松隆里全里","27261118",
"706","松山家商廣設大樓212教室","松山路655號","松友里1-5","松友里全里","27261118",
"707","松山家商廣設大樓111教室","松山路655號","松友里6-10","27261118",
"708","松山家商廣設大樓112教室","松山路655號","松友里11-16","27261118",
"709","松山家商廣設大樓113教室","松山路655號","松友里17-21","27261118",
"710","松山家商廣設大樓213教室","松山路655號2樓","松光里2-9","27261118",
"711","松山家商廣設大樓312教室","松山路655號2樓","松光里10-16","松光里全里","27261118",
"712","松山家商廣設大樓313教室","松山路655號2樓","松光里1,17-23","27261118",
"713","瑠公國中812教室","福德街221巷15號","中坡里1-4","中坡里全里","27261481-400",
"714","瑠公國中811教室","福德街221巷15號","中坡里5-8","27261481-400",
"715","瑠公國中810教室","福德街221巷15號","中坡里9-12","27261481-400",
"716","瑠公國中809教室","福德街221巷15號","中坡里13-16","27261481-400",
"717","福德國小五福樓505知動教室1","福德街253號","中行里1-6","27277992",
"718","福德國小五福樓505知動教室2","福德街253號","中行里7-13","27277992",
"719","福德國小四維樓穿堂〈前〉","福德街253號","中行里14-20","中行里全里","27277992",
"720","福德國小四維樓穿堂〈後〉","福德街253號","中行里21-26","27277992",
"721","福德國小四維樓1樓教師會","福德街253號","中行里27-32","27277992",
"722","協和工商協和大樓第105教室","忠孝東路5段790巷27號","大道里6-10","27265775",
"723","協和工商協和大樓第106教室","忠孝東路5段790巷27號","大道里16-20,22","27265775",
"724","協和工商協和大樓第107教室","忠孝東路5段790巷27號","大道里1,11-14","大道里全里","27265775",
"725","協和工商協和大樓第108教室","忠孝東路5段790巷27號","大道里2-5,15,21","27265775",
"726","松山家商314教室","松山路655號2樓","大仁里15-20,28","27261118",
"727","松山家商315教室","松山路655號2樓","大仁里7-14","27261118",
"728","大仁里里民活動場所","林口街80巷8號","大仁里1-6,21-27","大仁里全里","87261376",
"729","信義國小115教室","松勤街60號","景新里1-7","27204005",
"730","信義國小117教室","松勤街60號","景新里8-13","27204005",
"731","信義國小119教室","松勤街60號","景新里14-20","景新里全里","27204005",
"732","吳興國小吳興1班教室","松仁路226號","惠安里1-6","惠安里全里","27200226",
"733","吳興國小吳興2班教室","松仁路226號","惠安里7-12","27200226",
"734","吳興國小吳興3班教室","松仁路226號","惠安里13-16,26-28","27200226",
"735","吳興國小課輔辦公室","松仁路226號","惠安里17-25","27200226",
"736","信義國中活動中心會議室〈一〉","松仁路158巷1號","三張里2-3,8-13","27236771",
"737","信義國中生活科技教室〈一〉","松仁路158巷1號","三張里16-21","27236771",
"738","信義國中8年1班教室","松仁路158巷1號","三張里25-30","27236771",
"739","信義國中9年15班教室","松仁路158巷1號","三張里6,22-24,34","三張里全里","27236771",
"740","信義國中7年14班教室","松仁路158巷1號","三張里31-33,35-36","27236771",
"741","吳興國小2年1班教室","松仁路226號","三張里1,4-5,7,14-15","27200226",
"742","吳興國小多功能教室1","松仁路226號","三犁里1-9","27200226",
"743","吳興國小多功能教室2","松仁路226號","三犁里10-15","三犁里全里","27200226",
"744","吳興國小6年9班教室","松仁路226號","三犁里16-23","27200226",
"745","吳興國小1年1班教室","松仁路226號","六合里1-7,35","27200226",
"746","吳興國小1年2班教室","松仁路226號","六合里8-14","27200226",
"747","吳興國小1年3班教室","松仁路226號","六合里15-24","六合里全里","27200226",
"748","松山工農園藝科實習農場101綜合教室","吳興街600巷107號之1","六合里25-34","27224771",
"749","吳興國小2年2班教室","松仁路226號","泰和里1-6","27200226",
"750","吳興國小2年3班教室","松仁路226號","泰和里7-14","27200226",
"751","吳興國小2年4班教室","松仁路226號","泰和里15-20","27200226",
"752","吳興國小特教班知動室","松仁路226號","泰和里21-24","27200226",
"753","吳興國小5年8班教室","松仁路226號","泰和里25-29","泰和里全里","27200226",
"754","三興國小資源三教室","基隆路2段99號","景聯里1-8","景聯里全里","27364687",
"755","三興國小1年1班教室","基隆路2段99號","景聯里9-16","27364687",
"756","三興國小1年2班教室","基隆路2段99號","景聯里17-26","27364687",
"757","三興國小1年3班教室","基隆路2段99號","景勤里1-5","27386488",
"758","三興國小1年4班教室","基隆路2段99號","景勤里6-11","27385488",
"759","三興國小樂活教室","基隆路2段99號","景勤里12-16","景勤里全里","27364687",
"760","雙和里里民活動場所","吳興街284巷24弄16號1樓","雙和里14-21","雙和里全里","23770917",
"761","雙和社區發展協會","吳興街284巷24弄12號1樓","雙和里4-6,11-13","23781447",
"762","廣安宮","吳興街284巷30弄47號1樓","雙和里7-10,24","27371489",
"763","台北醫學大學8101教室","吳興街250號","雙和里1-3,22-23","27361161-2310",
"764","三興國小廚房旁穿堂","基隆路2段99號","嘉興里1-9","嘉興里全里","27364687",
"765","三興國小環境教育教室","基隆路2段99號","嘉興里10-17","27364687",
"766","喬治高職浩然樓〈一〉教室","基隆路2段155號","黎順里1-7","黎順里全里","27386515",
"767","喬治高職浩然樓〈二〉","基隆路2段155號","黎順里8-14","27386515",
"768","喬治高職浩然樓2樓電梯大廳","基隆路2段155號","黎順里15-20","27386515",
"769","安順宮","嘉興街317號旁","黎平里1-6","27352607",
"770","安順宮旁空地","嘉興街315號旁","黎平里7-12","黎平里全里","27336243",
"771","福德爺宮","崇德街132號旁","黎平里13-18","27322504",
"772","福德爺宮旁空地","崇德街132號旁","黎平里19-24","27322504",
"773","黎忠區民活動中心研習教室","和平東路3段391巷16號2樓","黎忠里1-7","27331469",
"774","黎忠區民活動中心會議室〈前〉","和平東路3段391巷16號2樓","黎忠里8-14","黎忠里全里","27331469",
"775","黎忠區民活動中心會議室〈後〉","和平東路3段391巷16號2樓","黎忠里15-19","27331469",
"776","大我新莊聯勤202廠退員宿舍大智樓1樓文康室","和平東路3段555巷8號1樓","黎安里1-2,7-11","黎安里全里","27382410",
"777","國防部大我新舍自治會大義樓中山室","和平東路3段599號","黎安里3-6","27335790",
"778","正守里固定里民活動場所","市民大道2段67巷26號１樓","正守里1-7","正守里全里","0972-295601",
"779","林森區民活動中心","林森北路67巷7號1樓","正守里8-13","0988-179764",
"780","正義里固定里民活動場所","林森北路133巷78號","正義里8,9,11,13,17","0972-295602",
"781","環保局中正區清潔隊(忠孝分隊)","長安東路1段89號","正義里1-6","25817314",
"782","黃秀莊先生宅","林森北路145巷45號","正義里7,10,12,14-16","正義里全里","25116670",
